9407	Which film was released first, Jaws 2 or The Cockeyed Cowboys Of Calico County?
9408	Which country Mi Saw U's father is from?
9409	Who is Saw E's paternal grandfather?
9410	Who is the maternal grandmother of Prince Dmitri Alexandrovich Of Russia?
9411	Where did Benedikte Shetelig Kruse's father study?
9412	Which film whose director is younger, Baadasssss Cinema or One Woman To Another?
9413	Which film has the director who died earlier, The Great St. Louis Bank Robbery or Lombardi, Ltd.?
9414	Who is the aunt of Carl Löwenhielm?
9415	What is the place of birth of the director of film Twists Of Fate?
9416	Are both Capital C and The Apprentice Diplomat from the same country?
9417	When was Arthur Hill-Trevor, 1St Viscount Dungannon's father born?
9418	Who is the mother-in-law of Marie Of Blois, Duchess Of Anjou?
9419	Who was born earlier, Jēkabs Bīne or Paul Newham?
9420	What is the date of death of Margaret De Stafford's mother?
9421	Who is the paternal grandfather of Connor O'Brien, 2Nd Viscount Clare?
9422	Which film was released first, R.I.P.D. or Teresa'S Tattoo?
9423	Which film came out earlier, Olavina Udugore or A Pearl In The Forest?
9424	Why did Neville Chamberlain's father die?
9425	Was Mian Hussain or Kakan Hermansson born first?
9426	What is the cause of death of David Armstrong-Jones, 2Nd Earl Of Snowdon's mother?
9427	Do the movies The Big Blue and Baxter (Film), originate from the same country?
9428	Are director of film Peppermint Candy and director of film The Good, The Bad, The Weird both from the same country?
9429	Who is the maternal grandmother of Anna Of Württemberg?
9430	What nationality is the director of film Rule No. 1?
9431	Do both directors of films Bryllupsfotografen and Blind Spot (2018 Film) share the same nationality?
9432	Which film was released first, Le Donk & Scor-Zay-Zee or Terror Trap?
9433	Where was the place of death of Beata Elisabet Von Königsmarck's father?
9434	What is the award that the director of film Bangalore Naatkal earned?
9435	Are both The World According To James and Paul Colman Trio from the same country?
9436	Where was the place of death of Spencer Gibb's father?
9437	Where was the husband of Andrée Yanacopoulo born?
9438	Are both John Septimus Roe Anglican Community School and St Mary'S Cathedral College, Sydney located in the same country?
9439	Which film has the director who died later, Wells Fargo (Film) or Sevmek Ve Ölmek Zamanı?
9440	Which film has the director who died first, The Cantabrians or Week-End In Havana?
9441	Who died earlier, Orson Desaix Munn Ii or Mona Best?
9442	Where did Aphareus (Writer)'s father die?
9443	Which film has the director born later, Back To The Door or Charles, Dead Or Alive?
9444	Where did Michele Mari's father study?
9445	Which film has the director who was born earlier, Sleepers East or The Other Side Of Sunday?
9446	Which film has more directors, Los Enchiladas! or Before Tomorrow?
9447	What is the place of birth of Hatheburg Of Merseburg's husband?
9448	Which film has the director who was born later, Sexo, Pudor Y Lágrimas or Variety (1971 Film)?
9449	Who is the uncle of Nicaea Of Macedon?
9450	Did the movies Boynton Beach Club and The Conformist (1970 Film), originate from the same country?
9451	Which film whose director is younger, Aach... Aku Jatuh Cinta or Ferragosto In Bikini?
9452	Which film has the director born later, Vampire In Brooklyn or A Girl From Hunan?
9453	Who is the paternal grandfather of Bohemond Iv Of Antioch?
9454	Which film was released earlier, The Star Of Valencia or The Commuters?
9455	Which film has the director who died first, Through The Neighbor'S Window or Lake Of The Dead?
9456	Who is the father-in-law of Empress Xiao'Aizhe?
9457	When did Edward Cromwell, 3Rd Baron Cromwell's father die?
9458	Which film was released first, Only When I Dance or The Wicked Dreams Of Paula Schultz?
9459	Where did the director of film Search And Destroy (1995 Film) study?
9460	Where does Olaf Iii Of Norway's father work at?
9461	Which film has the director who died earlier, Flying Pat or Pension Mimosas?
9462	Which film has the director who was born earlier, Angélique, Marquise Des Anges or That Man George?
9463	Where was the place of death of the composer of song They Can'T Take That Away From Me?
9464	What is the place of birth of the member of Kora Jazz Trio who left the band after three albums?
9465	Who is the paternal grandmother of Sir William À Court, 1St Baronet?
9466	Which film was released first, The Tender Years or Range War?
9467	Where did the director of film The Tracker (2002 Film) graduate from?
9468	Which film has the director died later, Below The Sahara or The Court Of Honor?
9469	Which film has the director who was born first, Bangaru Pichika or Nearly A Lady?
9470	Which film was released more recently, The Price Of Success or Rechipo?
9471	Which film came out earlier, Demi Ucok or Gutta-Percha Boy?
9472	Which film has the director who was born earlier, César And Rosalie or Beatrice (1987 Film)?
9473	Who is Erdmann August, Hereditary Prince Of Brandenburg-Bayreuth's paternal grandfather?
9474	Who is Prince Alexander Ferdinand Of Prussia's paternal grandmother?
9475	Who is Prince Albert Of Schleswig-Holstein-Sonderburg-Glücksburg's paternal grandfather?
9476	Which film has the director died earlier, Doughnuts And Society or Seven Deaths In The Cat'S Eye?
9477	Where was the father of Chris Rivers born?
9478	Who lived longer, Joseph Peyré or Iraj Kiarostami?
9479	When did Geoffrey Ii, Count Of Perche's father die?
9480	Which film whose director is younger, Heartworn Highways or Me & You, Us, Forever?
9481	Where does Mikey Arroyo's mother work at?
9482	Did the bands No Doubt and Credit To The Nation, originate from the same country?
9483	Do Tian Yu and Michael Patrick Hearn have the same nationality?
9484	Do both films, Chasing Fortune and Love Is Blind (1925 Film), have the directors who are from the same country?
9485	Where did the composer of song Moonlight Bay die?
9486	Who is Charles D'Évreux's paternal grandfather?
9487	Which film has the director who died later, Le Foto Proibite Di Una Signora Per Bene or Licenza Premio?
9488	When did Toda Of Pamplona's mother die?
9489	Which country the director of film Heatseeker (Film) is from?
9490	Which country Araya Selassie Yohannes's wife is from?
9491	What nationality is the director of film Öndög?
9492	Who is Fernando Bermúdez De Cea's uncle?
9493	Where was the place of burial of Walburga Habsburg Douglas's father?
9494	Who is Vivian Dandridge's sibling-in-law?
9495	Who is Walter Long (Died 1610)'s paternal grandfather?
9496	Which song was released earlier, Come And See Me or Hanging On To Nothing?
9497	Where did the director of film Defilada graduate from?
9498	Which film has the director died later, Too Many Winners or The Projectionist?
9499	Did Bruno Bonicontro and Brett Novek have the same nationality?
9500	Who is Mansur Ad-Din Of Adal's uncle?
9501	What nationality of the company that published Safeguard (Magazine)?
9502	Which film has the director who was born first, The Parson And The Outlaw or The Black Marble?
9503	Who is Prince Hermann Friedrich Of Leiningen's paternal grandmother?
9504	Where did Isaac B. Desha's father die?
9505	Who is Infanta Alicia, Duchess Of Calabria's father-in-law?
9506	Are Cherry Creek (Colorado) and Jucurucu River both located in the same country?
9507	Who is the paternal grandmother of Marco Torlonia, 6Th Prince Of Civitella-Cesi?
9508	Where was the mother of Christiane Of Saxe-Merseburg born?
9509	Where was the leader of The Coalition Of The Willing (Band) born?
9510	Which film has the director died first, The Night Of Nights or Salt In The Wound?
9511	Who is Constance Of Normandy's paternal grandmother?
9512	Where was the performer of song I Want You (Shana Song) born?
9513	Who is the spouse of the director of film A Bill Of Divorcement (1940 Film)?
9514	Where does the director of film Working Woman (Film) work at?
9515	What nationality is the director of film The Wrecking Crew (2000 Film)?
9516	Which song was released earlier, Femme Like U (Donne-Moi Ton Corps) or Find You (Zedd Song)?
9517	Which film whose director was born first, Sextette or Kelkkaatha Sabdham?
9518	Which film has the director died later, The Wax Model or Khoon Ka Karz?
9519	Where does the presenter of The Next List work at?
9520	What is the place of birth of the director of film Adam And Eve (1923 Film)?
9521	Do both films Rawhide Mail and Death Of A Dynasty have the directors that share the same nationality?
9522	Where does Thaddeus P. Mott's father work at?
9523	Which song was released earlier, Right Back At It Again or Donne-Moi Le Temps?
9524	What is the place of birth of the director of film Ana, Mon Amour?
9525	Which film whose director was born first, Gentleman'S Agreement or Bhagam Bhag?
9526	What is the cause of death of director of film Destination: Dewsbury?
9527	What is the place of birth of Marike De Klerk's husband?
9528	Where did the director of film Bangalore Naatkal graduate from?
9529	Where was the place of burial of Ginevra D'Este's father?
9530	What is the place of birth of the performer of song Yo No Tengo Nah?
9531	Were Michelle Shocked and James Thackara from the same country?
9532	Do both directors of films Unmarried (1939 Film) and Places In Cities have the same nationality?
9533	Which film has the director who died later, Anne Of The Indies or One Hour Of Love?
9534	Was Catherine Neilson or Ramiro Viáfara born first?
9535	Do Samuel Langdon and Emil Aloysius Wcela share the same nationality?
9536	Are William David O'Brien and Bob Galvin of the same nationality?
9537	Who is the wife of James Corrigan?
9538	Which film has the director who is older, Cry Of The Hunted or Blowing Wild?
9539	Which film has the director who died later, Goya Or The Hard Way To Enlightenment or Sins Of Rome?
9540	Who is the spouse of the director of film A Bullet Is Waiting?
9541	What is the place of birth of the performer of song Palmeras En La Nieve (Song)?
9542	Where did Taj Al-Dawla's father die?
9543	Who is the spouse of the director of film One, But A Lion!?
9544	Which film was released first, Devara Maga or Bruce Almighty?
9545	Where does the director of film Suzanne'S Career work at?
9546	Who lived longer, Charles L. Biedenbach or Merle Tottenham?
9547	Which film has the director died first, Bezawada Bebbuli or Mistress Of The World?
9548	Are David Wants To Fly and The Three From The Filling Station (1955 Film) both from the same country?
9549	What is the place of birth of the creator of It'S Only Tv?
9550	Where was the father of Princess Jeguk born?
9551	What is the place of birth of the director of film Random Encounter (Film)?
9552	Who is the spouse of the director of film Terminal Bliss?
9553	Where was the place of death of Louis Of France (1264–1276)'s father?
9554	Who is the father-in-law of Ameera Al-Taweel?
9555	Where was the director of film Grinning Guns born?
9556	Which film was released more recently, A Small Ball Shot By A Midget or I'M Not There?
9557	Are Tauheed Railway Station and Tamluk Junction Railway Station both located in the same country?
9558	Who is the spouse of the director of film The Imp (1919 Film)?
9559	Who died later, Joachim Gasquet or T. J. Richards?
9560	Which film has the director who died later, The Devil And Miss Jones or The Man In The Funny Suit?
9561	Where did the director of film 13 Fighting Men die?
9562	Where did Alden B. Dow's father study?
9563	Who is Isabel Of Barcelos's maternal grandmother?
9564	Which film has the director born later, Dangerous Millions or The Blonde With Bare Breasts?
9565	What is the date of death of the director of film Break The News (Film)?
9566	Where did the performer of song I Don'T Wanna Get Hurt die?
9567	Which film was released first, A Simple Wish or Lake Of Ladies?
9568	Who is the father of the director of film Snake In The Eagle'S Shadow?
9569	Who is Jagat Singh (Raja Of Isarda)'s father?
9570	Where did the director of film Wolves Of The North die?
9571	Which film came out first, The Ex-Wife Of My Life or Wrangler'S Roost?
9572	When is the founder of Suez Canal Company 's birthday?
9573	Who is Somerset Butler, 1St Earl Of Carrick's paternal grandmother?
9574	Which film was released earlier, 69 And Dead or Hellbilly 58?
9575	Which film has the director born first, Mutiny (1952 Film) or The Eagle'S Feather?
9576	Who is Pompeia Paulina's father-in-law?
9577	Who is the spouse of the director of film Confidentially Connie?
9578	Where did the director of film Masked Emotions study?
9579	Which film was released first, Alien Cargo or A Season In Hakkari?
9580	Which film whose director was born first, The Stolen Ranch or The Father Of The Girl?
9581	What nationality is the director of film Claustrophobia (2003 Film)?
9582	Where did the director of film Blondie Johnson die?
9583	Who is Theudebert Of Soissons's paternal grandmother?
9584	Are both Bismarck (1914 Film) and 205 – Room Of Fear from the same country?
9585	Which country Princess Marie Louise Of Bourbon-Parma's father is from?
9586	Which film has the director died later, The Desert Man or Violent Saturday?
9587	Which film came out first, Deadly Prey or Ghamandee?
9588	Who is the child of the composer of song Not In Nottingham?
9589	Who is the paternal grandfather of Walter Aston, 4Th Lord Aston Of Forfar?
9590	Who is Cedda's paternal grandfather?
9591	Which film has the director who is older, Angels Revenge or The Devil'S Backbone?
9592	Who is the father-in-law of Empress Liu E?
9593	Which film has the director who died first, Alf, Bill And Fred or Act Of Violence?
9594	Where was the father of Adam Kazimierz Czartoryski born?
9595	Do both films Summer Wishes, Winter Dreams and The Rules Of Attraction (Film) have the directors that share the same nationality?
9596	Where was the place of death of the performer of song All Systems Go (Song)?
9597	What is the date of death of Thomas Foley, 2Nd Baron Foley (1703–1766)'s father?
9598	Which film has the director who was born first, Defending Your Life or Labyrinth Of Passion?
9599	Which film was released earlier, Junior Mandrake or La Tour Montparnasse Infernale?
9600	Who is older, Jacob Biltius or Talel Chedly?
9601	Do both films Hearts In Exile (1915 Film) and Sunshine Sally have the directors from the same country?
9602	Who was born later, Cathal O'Grady or Jens Hellgren?
9603	Which film has the director who was born earlier, The Red-Haired Alibi or Blondes By Choice?
9604	Which film has the director who was born earlier, The Man In The Raincoat or Secret Of Treasure Mountain?
9605	Which film has the director died earlier, La Moglie Vergine or Melvin And Howard?
9606	Where was the director of film The Rainbow Princess born?
9607	Which film has the director who died earlier, Ada (Film) or When A Girl'S Beautiful?
9608	Are both John Stevens (Victoria Cricketer) and Chloe Shorten from the same country?
9609	What is the award that the founder of Reality Of Wrestling got?
9610	Which film has the director who is older, Song Of The Eagle or Yukon Vengeance?
9611	Who was born later, Kiplangat Sang or Stein Erik Hagen?
9612	Which country the director of film E A Vida Continua... is from?
9613	Where did the performer of song Fantasy (George Michael Song) die?
9614	What is the place of birth of Rohese Of Monmouth's husband?
9615	Which film has the director died earlier, Ludwig Ii, King Of Bavaria or Meyer From Berlin?
9616	What is the date of birth of William Paulet, 3Rd Marquess Of Winchester's father?
9617	Which film has the director born earlier, Charley One-Eye or A Glimpse Of Paradise?
9618	Who is the father of the director of film The Female: Seventy Times Seven?
9619	Who is the paternal grandmother of Edward Harley, 4Th Earl Of Oxford And Earl Mortimer?
9620	Who was the teacher of the composer of song Prometheus (Art Song)?
9621	Where was the mother of Michael Douglas born?
9622	Where was the place of death of the performer of song Are You Sincere?
9623	Are Stary Onokhoy and Vtorye Korosteli located in the same country?
9624	Do both films: A Slave Of Vanity and Grace Of My Heart have the directors from the same country?
9625	Which film was released more recently, Little Suck-A-Thumb or Lucky Fugitives?
9626	Which film has the director who is older than the other, Airheads or Return To Cabin By The Lake? 
9627	When did Richard Abel Smith's father die?
9628	What is the place of birth of the director of film Mallrats?
9629	When was the director of film The Car born?
9630	Where was the place of death of Teofila Ludwika Zasławska's father?
9631	What is the place of birth of Catherine Barclay's husband?
9632	Which film has the director who was born later, Iniyum Puzhayozhukum or The Headline Woman?
9633	Where did Alfonso Xi Of Castile's father die?
9634	Which film whose director is younger, Bazaar Rowdy or Dances With Wolves?
9635	What is the date of death of the director of film Le Bossu (1959 Film)?
9636	Which film has the director born first, Avasara Police 100 or Iniyum Puzhayozhukum?
9637	Do both films I.K.U. and Jailhouse Rock (Film) have the directors from the same country?
9638	Where did the director of film Baree, Son Of Kazan (1918 Film) die?
9639	Where was the husband of Elena Ecaterina Rareș born?
9640	Where was the place of death of the director of film The Earring?
9641	Are both movies, A Thousand Stars Aglitter and Wild (2016 Film), from the same country?
9642	When did Philipp, Prince Of Hohenlohe-Langenburg's father die?
9643	What is the place of birth of the director of film The Black Cover?
9644	Who was born first out of Momed Hagi and Lee Richmond?
9645	Do both films In This World and The Big Money (Film) have the directors that share the same nationality?
9646	Where was the place of death of the composer of song La Chanson D'Ève?
9647	Which country the director of film Pacientka Dr. Hegla is from?
9648	Are the directors of films Out Of The Ruins (Film) and Brainwashed (Film) both from the same country?
9649	Which film has the director who died first, Murder At Monte Carlo or Welcome 2 Ibiza?
9650	Who was born earlier, Marjatta Raita or Bruce Coulter?
9651	Which film whose director was born first, Johnny On The Run or Six And One Half Times Eleven?
9652	What nationality is Princess Elise Of Hohenlohe-Langenburg's father?
9653	Who is Empress Xu (Ming Dynasty)'s father-in-law?
9654	Where was the husband of Wilhelmine Of Prussia, Margravine Of Brandenburg-Bayreuth born?
9655	Are both Iceman (2017 Film) and The Bread Peddler (1963 Film) from the same country?
9656	Do both films Up And At 'Em and The Colonel (1917 Film) have the directors from the same country?
9657	What is the place of birth of the director of film Martian Child?
9658	Where was the place of burial of the director of film Alice In The Navy?
9659	Which film was released first, Battle Of Kosovo (Film) or Quackser Fortune Has A Cousin In The Bronx?
9660	Who died later, Alfred Zerbel or Trevor Colbourn?
9661	Are both movies, The Revenge Of Maciste and Il Sindacalista, from the same country?
9662	Which film has the director who died first, The No-Gun Man or Personal Maid'S Secret?
9663	Which award the performer of song One More Time (Joe Jackson Song) earned?
9664	Where does Maureen Reagan's mother work at?
9665	Who is older, Lisa O'Keefe or Anan Buasang?
9666	Who is the mother-in-law of Queen Hyojeong?
9667	What is the place of birth of the director of film The Village Sleuth?
9668	Which film came out first, Maangamizi: The Ancient One or Cane Toads: An Unnatural History?
9669	Are Trenton Aerodrome and Mackenzie Airport both located in the same country?
9670	What is the place of birth of the founder of Union Sulphur Company?
9671	When did Eugen Maximilianovich, 5Th Duke Of Leuchtenberg's father die?
9672	Which film has the director born later, The Girl In Possession or Así En El Cielo Como En La Tierra?
9673	Which country the director of film The Taming Of The Snood is from?
9674	What is the place of birth of the composer of film Men With Brooms?
9675	What is the place of birth of the director of film Laadla (1994 Film)?
9676	What is the place of birth of the director of film 976-Evil Ii?
9677	Where was the director of film Adam At 6 A.M. born?
9678	Which film has the director who died later, The Heart Of Nora Flynn or A Vanished World?
9679	Who was born first out of Tonje Kristiansen and Evin Incir?
9680	Who lived longer, Trudeliese Schmidt or Yardena Alotin?
9681	When is the director of film Cooley High 's birthday?
9682	What nationality is the director of film Reckless Youth (1931 Film)?
9683	Where was the director of film Top Of The Form (Film) born?
9684	Who is the child of the director of film The Road To Fort Alamo?
9685	Where did Theodore Salisbury Woolsey's father study?
9686	Which film has the director who was born later, Talk Of The Devil or The Women House Of Brescia?
9687	Which film has the director who died first, Drift Fence or Death On The Set?
9688	Who is the child of the director of film Love Affair (Unreleased Film)?
9689	Where was the place of death of Thaddeus P. Mott's father?
9690	Who is younger, Mart Van Duren or Madeleine Simms?
9691	Where does William Goodfellow (Executive)'s wife work at?
9692	Did Ted Byfield and Josie Alice Quart have the same nationality?
9693	Who was born earlier, Andrew Renzullo or Miriam Cárdenas Cantú?
9694	Which film was released earlier, Dreams Of Glass or Strange Triangle?
9695	Which film has more directors, The Lords Of Flatbush or Víctimas Del Pecado?
9696	Which film was released more recently, Steadfast Benjamin or Cadavres?
9697	Which country Elizabeth Stuart, Queen Of Bohemia's husband is from?
9698	Where did Edward Of Middleham, Prince Of Wales's mother die?
9699	Which one was established first, Cebu Water or Faw-Volkswagen?
9700	Who is Gavin Hamilton, 2Nd Baron Hamilton Of Dalzell's paternal grandfather?
9701	Where was the place of death of the composer of song They All Laughed (Song)?
9702	Which album was released first, Pandora'S Piñata or Rat Farm?
9703	Who is the mother of Jean Kennedy Smith?
9704	Which film whose director is younger, Song Of The Prairie or Ramen Teh?
9705	Do both films Underground (1941 Film) and Rounders (Film) have the directors from the same country?
9706	Which country the director of film First Of May (1958 Film) is from?
9707	Who is the spouse of the performer of song Hold On (Rosanne Cash Song)?
9708	Who was born first out of Petko Todorov and Hugo Aufderbeck?
9709	What nationality is Puahi's father?
9710	Who is the paternal grandfather of Ferdinand Maximilian, Hereditary Prince Of Baden-Baden?
9711	Which film has the director born later, The Jackhammer Massacre or License To Wed?
9712	Which country Catherine Of Thouars's father is from?
9713	Where was the place of death of Eurydice Of Egypt's husband?
9714	What is the place of birth of the director of film Heavenly Swallows?
9715	Which film has the director who is older than the other, Rani Mera Naam or Temptation In The Summer Wind? 
9716	What nationality is the director of film Code Blue (Film)?
9717	Which film came out first, Scratch And Crow or Big Nothing?
9718	Which film has the director who is older than the other, The Lone Prairie or Buckaroo From Powder River? 
9719	Who is the maternal grandmother of Countess Johanna Magdalene Of Hanau-Lichtenberg?
9720	Where did Francisco De Benavides's father die?
9721	When did William Christoph, Landgrave Of Hesse-Homburg's father die?
9722	Do the movies Girl On The Loose and S For Sex, S For Secret, originate from the same country?
9723	Which film was released more recently, Masquerade In Mexico or Magic Magic 3D?
9724	Which film has the director who was born first, O'Shaughnessy'S Boy or Sunday Light?
9725	Are the directors of both films Pretty Foe and Goin' Coconuts from the same country?
9726	Which film has the director who was born first, Coming To Terms With The Dead or Phantom Of Death?
9727	What is the place of birth of Duke Louis Of Württemberg's father?
9728	Which film has the director who died earlier, Five Red Tulips or Laughing At Death?
9729	Who is Matilda Of Ringelheim's father-in-law?
9730	Which film has the director born earlier, A Guy And A Gal or Chakravarthi Thirumagal?
9731	Who was born first out of Oto Luthar and Jean-Pierre Sylvestre De Grateloup?
9732	Where was the place of death of Amadea Palaiologina Of Montferrat's father?
9733	Who is Katherine Brandon, Duchess Of Suffolk's mother?
9734	Did the movies American Boyfriends and La Forteresse (Film), originate from the same country?
9735	What is the date of death of Dmitri Sheremetev's father?
9736	Which film has the director died later, Vamsa Vruksham or Conqueror Of Atlantis?
9737	Which country the director of film The Beckoning Flame is from?
9738	Are the movies It (1966 Film) and Faust (1960 Film), from the same country?
9739	Who is Otto Iii, Prince Of Anhalt-Bernburg's paternal grandfather?
9740	Which album was released first, Born Villain or La La La Love Thang?
9741	Where was the place of death of Princess Yolanda Of Savoy's father?
9742	Which film has the director who was born later, Atheetham or Otec Neznámý Aneb Cesta Do Hlubin Duše Výstrojního Náčelníka?
9743	Which film has the director who died later, Mana Desam or Les Visiteurs Du Soir?
9744	Which country the director of film Desire Inc. is from?
9745	Who is the father of the director of film Drunken Tai Chi?
9746	Who died earlier, Anđelko Habazin or Ivo Pelay?
9747	Who died later, Frederick I, Elector Of Saxony or Merton Russell-Cotes?
9748	Which film has more directors, The Burned Barns or The Nevadan?
9749	Which film has the director who was born first, Women He'S Undressed or The King'S Stamp?
9750	When did Thomas Of Galloway (Bastard)'s father die?
9751	Where does Jean David-Weill's father work at?
9752	Who is Eleonora, Princess Of Ligne's father-in-law?
