6283	When did Edward Douglas-Pennant, 3Rd Baron Penrhyn's father die?
6284	Who is the maternal grandmother of Prince René Of Bourbon-Parma?
6285	"Who died later, Abbye ""Pudgy"" Stockton or Giuseppe Drugman?"
6286	Where was the performer of song Whispers (Corina Song) born?
6287	Who lived longer, Olivier Long or Robert Ernest Cheesman?
6288	Who died later, Pieter Corneliszoon Hooft or Rudi Carrell?
6289	Are both Castor River (Ontario) and Amiskwi River located in the same country?
6290	Are Kaitlyn (Wrestler) and Phillip Jeanmarie of the same nationality?
6291	Who is Edith Of Wessex's mother-in-law?
6292	Where was the place of burial of Karomama Meritmut's father?
6293	What is the place of birth of the composer of film The Case Of The Scorpion'S Tail?
6294	Where was the place of death of Geoffrey Plantagenet, Count Of Anjou's wife?
6295	What is the place of birth of Hugh Le Despenser, Baron Le Despenser (1338)'s mother?
6296	What is the place of birth of the director of film Angus (Film)?
6297	Which film has the director born later, The Purple Plain or Chief Guest?
6298	Who is the father-in-law of Ove Aunli?
6299	Which film came out earlier, Muddula Priyudu or Woh College Kay Din?
6300	Who is Walter Maule's paternal grandfather?
6301	Which film came out earlier, Saints And Soldiers or Ghosts Of Mars?
6302	Who is the father of the director of film El Protegido?
6303	Who was born later, Annika Uvehall or Scott Mckenna?
6304	Who is the paternal grandfather of Margaret Drummond (Mistress)?
6305	Who was born first, Tomáš Troliga or Gary Basaraba?
6306	Which film has the director who is older, Kai Po Che! or Waiting Room To The Beyond?
6307	Are both Gonebiskari and Khalifeh Kandi, Markazi located in the same country?
6308	Are director of film Ward No.7 and director of film Family Katta from the same country?
6309	Where was the place of death of Kosala Devi's husband?
6310	Who was born later, Kurt Vespermann or Erica Udén Johansson?
6311	Who is the paternal grandmother of Princess Alexandrine Of Prussia (1842–1906)?
6312	Who was born later, Haris Bashir or Mokete Mokhosi?
6313	Which film has the director who is older than the other, Kanchana Sita or Ghost Of The China Sea? 
6314	Who is Demmán Mac Cairell's paternal grandfather?
6315	Where was the performer of song 11 Pm (Song) born?
6316	Where did Prince David Of Kakheti's father die?
6317	Which one was established first, Up Tied or Akbank?
6318	What is the award that the director of film Schwechater got?
6319	Which film has the director born later, Island Of Lost Men or Call Of The Jungle?
6320	Which film whose director is younger, Pacific Rendezvous or Calling Bulldog Drummond?
6321	Where was the place of death of the composer of film There Goes My Heart (Film)?
6322	Which film whose director is younger, Ooh... Diese Ferien or Rogue Of The Range?
6323	Who is the father-in-law of Lady Zhang (Lü Shao'S Wife)?
6324	Which film has the director who was born first, The Butterfly Lifts The Cat Up or Turn On To Love?
6325	Which film has the director born earlier, Questa Volta Parliamo Di Uomini or The Heart Of A Man?
6326	Which film has the director who died earlier, Oi Kyries Tis Avlis or Maurin Of The Moors?
6327	Who was born first, Peter Møller or Jitender Singh Shunty?
6328	Who is Prince Karl Franz Of Prussia's maternal grandfather?
6329	Which country the director of film Dhund (2003 Film) is from?
6330	Who lived longer, Emilio Drake, 1St Marquess Of Cañada Honda or Franjo Marković?
6331	What is the award that the director of film Knockout (2011 Film) got?
6332	Are both director of film Human Zoo (Film) and director of film Venus Fra Vestø from the same country?
6333	Who lived longer, Ludovico Sabbatini or Marcelino Manuel Da Graça?
6334	Where was the father of Dániel Esterházy born?
6335	Where did the director of film The Sun Sets At Dawn study?
6336	Which film has the director died earlier, La Cérémonie or Who Is The Guilty??
6337	Do both films: Smarty (Film) and Crime And Punishment (1998 Film) have the directors from the same country?
6338	Which film has the director born first, Charge Of The Model T'S or Girls Of The Night?
6339	Which country the director of film Magic Trick (Film) is from?
6340	Where did George Pelham (Bishop)'s father die?
6341	Which film has the director who was born later, Know Thy Wife or Pardon My Backfire?
6342	What is the place of birth of the director of film Mice And Men (Film)?
6343	Which album was released earlier, Welcome To Sideways or Another Mayberry?
6344	Who was born first, Auguste-Louis Lepère or Paulina Guz?
6345	Who is older, Mario Baccini or Béchir Sfar?
6346	Who is Agnes Of Aquitaine, Queen Of Aragon And Navarre's father-in-law?
6347	What is the place of birth of the founder of university Catholic University In Erbil?
6348	Who is Stephen, Count Of Tréguier's paternal grandmother?
6349	What is the date of death of Charles Gordon-Lennox, 10Th Duke Of Richmond's father?
6350	What nationality is Caroline Of Hesse-Homburg's father?
6351	Who is Duke Georg Alexander Of Mecklenburg-Strelitz's maternal grandfather?
6352	Where did George Rideout's father die?
6353	Where was the place of death of Julia Minor (Sister Of Caesar)'s mother?
6354	What is the date of birth of Hedvig Elizabeth Von Biron's mother?
6355	Did the movies The Veteran Of Waterloo and Believe Me, Xantippe, originate from the same country?
6356	Where was the performer of song Sorry, Sorry (Femi Kuti Song) born?
6357	Who is Edward Howard, 2Nd Earl Of Carlisle's paternal grandfather?
6358	Which film has the director who is older than the other, The Sarah Balabagan Story or Wine, Women And Horses? 
6359	Which film has the director who died first, The Quiller Memorandum or La Quintrala?
6360	Who is the spouse of the director of film You Talkin' To Me? (Film)?
6361	Who is the maternal grandmother of Duchess Amalie In Bavaria?
6362	When is Gomes Echigues's father's birthday?
6363	Which film came out earlier, My Dear Desperado or Moner Manush?
6364	What nationality is the director of film Galapagos (1955 Film)?
6365	What is the place of birth of the director of film Living On Tokyo Time?
6366	Who was born first, Lady Tatiana Mountbatten or Peter Štih?
6367	Are Moree Railway Station and Molesworth Railway Station located in the same country?
6368	Are both The Story Of Piera and Bloody Richard from the same country?
6369	What is the date of death of the composer of song Limehouse Blues (Song)?
6370	Are both Paul Elward and Margo Sappington from the same country?
6371	Which country Nido Taniam's father is from?
6372	Which film has the director who was born first, Nasib Si Labu Labi or Solo Per Te Lucia?
6373	Where was the place of death of Clara Maria Of Pomerania-Barth's father?
6374	Who is the paternal grandfather of Jalal Al-Dawla?
6375	Who is Robert I, Count Of Troyes's uncle?
6376	Which film has the director who was born later, It'S A Bikini World or A Moment Of Romance?
6377	What is the place of birth of Leni Sinclair's husband?
6378	Who is the paternal grandfather of Arthur Jones, 2Nd Viscount Ranelagh?
6379	Where was the place of burial of Dexter King's mother?
6380	Which film came out earlier, Music For A Blue Train or Big Eden?
6381	Was Bronisław Dembowski or Carlo Delle Piane born first?
6382	Are director of film Teaching To See and director of film Analyze This from the same country?
6383	What nationality is Wenceslaus I Of Legnica's father?
6384	Where did the director of film The Mikado (1967 Film) graduate from?
6385	Do both Next Time We Love and A Master Builder films have the directors from the same country?
6386	What is the date of death of the director of film Madame La Presidente?
6387	Which film has the director who was born first, Just Before I Go or Nobadi?
6388	Which film has the director who is older, Sordid Lives or And The Violins Stopped Playing?
6389	Which film came out earlier, Deeper And Deeper (Film) or Arriba El Telón O El Patio De La Morocha?
6390	Which film came out first, The Coastline or Un Elefante Color Ilusión?
6391	Which film has the director who was born earlier, Dokuzuncu Hariciye Koğuşu or An Open Secret?
6392	Which film has the director who was born earlier, The King'S Prisoner or Pay As You Exit?
6393	What is the place of birth of the director of film Judy And Punch?
6394	Who was born first, Choi Jin-Sil or Gabriel Donev?
6395	Which film has the director who was born first, Horrible Bosses or Some Kind Of Life?
6396	Where was the director of film The Boy With The X-Ray Eyes (Film) born?
6397	Who is the paternal grandfather of Ferdinand Zvonimir Von Habsburg?
6398	Which film has the director who died earlier, An Everyday Story or My Daughter'S Tutor?
6399	Where was the director of film An Hour Before Dawn born?
6400	What nationality is Zainab Sultan Begum's husband?
6401	What is the place of birth of Nadia Benois's father?
6402	Who was born later, Jerry Hardin or Harry Sinclair Drago?
6403	What is the place of birth of the director of film Blood And Henna?
6404	Who died earlier, Henry Curwen or Olimpia Giustiniani?
6405	What is the place of birth of the director of film Budak Nafsu?
6406	Where was the father of Bhaktisiddhanta Sarasvati born?
6407	Which film has the director who was born first, In A Year Of 13 Moons or If I Had To Do It All Over Again?
6408	Do both directors of films Rich And Strange and The Sunset Legion have the same nationality?
6409	Why did Thomas Henty's father die?
6410	Where did Oei Hui-Lan's father die?
6411	Which film has the director who was born later, Broder Gabrielsen or Bhakta Kannappa?
6412	What nationality is Himiltrude's husband?
6413	What nationality is Azam Jah's father?
6414	Which film has the director who died earlier, Holiday In Tyrol or Las Aventuras De Pito Pérez?
6415	Who is the spouse of the director of film Hannele'S Journey To Heaven?
6416	Which film has the director born later, The Borrowed Babies or Ayaash?
6417	What is the place of birth of Julian Hawthorne's father?
6418	Where was the director of film The Hands Of Orlac (1960 Film) born?
6419	Which film was released more recently, Face/Off or Last Of The Renegades?
6420	Where was the place of death of the director of film On Their Own?
6421	Who is Jan Of Cieszyn's paternal grandfather?
6422	Who is Máel Coba Mac Áedo's paternal grandfather?
6423	What nationality is Henry Scott, 1St Earl Of Deloraine's father?
6424	Who is Gnaeus Pompeius Magnus (Husband Of Claudia Antonia)'s maternal grandmother?
6425	Where was the director of film The Story Of Molly X born?
6426	Which film was released earlier, The Terminal or Perceval Le Gallois?
6427	Which film was released more recently, The Secret Life Of Pets 2 or Love Me Deadly?
6428	What is the award that the composer of film Timerider: The Adventure Of Lyle Swann won?
6429	Which film has the director who is older, The Right Person or The Curtain Falls?
6430	Who is the child of the director of film Truth Or Consequences, N.M. (Film)?
6431	Which film came out earlier, This Night Is Still Ours or Huma Gun Anmogaldi?
6432	Which film has the director who died later, The Duchess Of Doubt or The Golden Trail?
6433	Which film came out first, Ek Din 24 Ghante or No Me Quieras Tanto...?
6434	Who is the father of the performer of song Everybody Needs A Best Friend?
6435	Was Euphonik or Beni Veras born first?
6436	What is the date of birth of Ernest Courant's father?
6437	Which film was released first, God'S Gun or Yuvaraju?
6438	Where was the father of Louise Lindh born?
6439	Where was the place of death of Rhena Schweitzer Miller's father?
6440	Where did the founder of Edison Manufacturing Company die?
6441	Do both Modesty Blaise (1966 Film) and Desperate Living films have the directors from the same country?
6442	Who was born later, Petko Voyvoda or Marcus Browne?
6443	Which film has the director who was born later, Felices 140 or Dr. Who And The Daleks?
6444	What nationality is the performer of song Am I Wrong (Étienne De Crécy Song)?
6445	Who was born first out of Mona Guérin and Setareki Tawake?
6446	Where did the editor of magazine Black Mask (Magazine) die?
6447	Do both films: Ripkin and This Man Is Mine (1934 Film) have the directors from the same country?
6448	Are Wiqu (Lima) and Qillqa (Melgar) both located in the same country?
6449	What is the date of death of William Howard, 8Th Earl Of Wicklow's father?
6450	Where was the place of death of the director of film Stella (1943 Film)?
6451	Who is the paternal grandfather of Bolesław Ii Of Niemodlin?
6452	Where was the place of burial of Aura Herzog's husband?
6453	Are the bands Shirehorses and From First To Last, from the same country?
6454	Which film has the director who is older, Naukar Biwi Ka or Rising To The Bait?
6455	Which country William Herbert, 18Th Earl Of Pembroke's father is from?
6456	Are both movies, The King And Four Queens and Argo (2012 Film), from the same country?
6457	Which film has the director died later, Magnum Force or Brilliant Waltz?
6458	Where was the place of death of the director of film The Palace Of Angels?
6459	Do the movies Where'S Sally? and On Chesil Beach (Film), originate from the same country?
6460	Which film has the director who is older, Ethnic Notions or Gordon Of Ghost City?
6461	Which film whose director is younger, South Park: Bigger, Longer & Uncut or Zille And Me?
6462	Do both New York (1916 Film) and The Lovers Of Marianne films have the directors from the same country?
6463	Who died earlier, Sir George Speke, 2Nd Baronet or Manuel Sadosky?
6464	Which film has the director who is older, Lakeview Terrace or The Grey House?
6465	Where was the director of film Absurda born?
6466	Which film has the director who is older than the other, This Is The Army or Na Svatém Kopečku? 
6467	Where was the place of death of Dürrünev Kadın's husband?
6468	Which film was released first, Jigyaasa or Assigned To Danger?
6469	Who is the paternal grandmother of Esmé Stewart, 3Rd Duke Of Lennox?
6470	Which film has the director who was born first, A Monster And A Half or Un Giorno Speciale?
6471	Which film whose director was born first, Star Of Texas or Tarantula!?
6472	Who is Countess Ferdinande Henriette Of Stolberg-Gedern's maternal grandfather?
6473	Are both Seattle Times Building and Philip Foster Farm located in the same country?
6474	Which film was released more recently, Mr. Dodd Takes The Air or Local Kung Fu 2?
6475	Are Vancouver Island and Spencer Island located in the same country?
6476	Where was the place of burial of the director of film Society Girl (1932 Film)?
6477	Who is the paternal grandfather of Adolf Iv, Count Of Berg?
6478	Which film came out earlier, Ustad Hotel or In Bed With Santa?
6479	Which film has the director died earlier, Toto And Cleopatra or Land Of Peace?
6480	Who is the mother-in-law of Countess Palatine Hedwig Elisabeth Of Neuburg?
6481	Who is Drusus Julius Caesar's mother-in-law?
6482	Are Guancangping Railway Station and Yangquan North Railway Station both located in the same country?
6483	Who was born first out of Alberto Casado Cerviño and Arjun Naidu?
6484	Where does Bernard Tschumi's father work at?
6485	Are And The Same To You and The King'S Romance from the same country?
6486	Which film has the director who was born later, The Mate Of The Sally Ann or The Legend Of Hercules?
6487	Who died earlier, Jan-Lauritz Opstad or Friedrich Wilhelm Von Reden?
6488	What is the award that the director of film Story Of A Poor Young Man (1968 Film) got?
6489	Which film came out earlier, Without The King or We Are Legion?
6490	Which film has the director died earlier, The Devil At 4 O'Clock or Encounters In The Deep?
6491	Where did Jean-Pierre Eckmann's father die?
6492	Which film has the director who is older than the other, The Flowers Of War or Tan De Repente? 
6493	Who was born first, Mary Lou Marzian or Charles Gonthier, Prince Of Schwarzburg-Sondershausen?
6494	Who is the paternal grandfather of Bruno Ii Von Berg?
6495	Which one was established first, The Gravity Group or Victoria'S Secret?
6496	Who is the paternal grandfather of Gilbert Kennedy, 4Th Earl Of Cassilis?
6497	Where did the director of film Shelley (Film) study?
6498	Which film whose director is younger, Widow'S Might or Pappa E Ciccia?
6499	Where did Abdul Rashid Ghazi's father die?
6500	Do both Dr. Ehrlich'S Magic Bullet and Fling (Film) films have the directors from the same country?
6501	Who is Nawrahta Of Kanni's uncle?
6502	What is the date of death of Elisabeth Of Meissen's father?
6503	When was Hector Macpherson Jr.'s father born?
6504	Where was the father of Johann Adolf I, Duke Of Saxe-Weissenfels born?
6505	Which film was released first, A State Of Mind or Love Before Breakfast?
6506	Which film has the director who is older, L'Eclisse or Tell It To Sweeney?
6507	Where did the director of film Circle Of The Sun study?
6508	Who is the father of the performer of song Quiero Estar Contigo?
6509	Which film has the director who died first, Karin Daughter Of Ingmar or The Man In The Trunk?
6510	Where was the place of death of the director of film Madame De La Pommeraye'S Intrigues?
6511	What is the place of birth of the performer of song Because Of You (Gabrielle Song)?
6512	Who was born earlier, Xavier Florencio or Dimitris Souanis?
6513	Where was the place of death of George Grey, 2Nd Earl Of Kent's father?
6514	Are Novoberezovka and Korostino both located in the same country?
6515	Are Emily Louise Orr Elliott and William Hutt (Actor) of the same nationality?
6516	Which film has the director who is older, La Norteña De Mis Amores or The Murder Of Dr. Harrigan?
6517	Where does Sharon Tiller's husband work at?
6518	Are the movies Alfred Von Ingelheim'S Dramatic Life and A Summer You Will Never Forget, from the same country?
6519	What is the place of birth of Teispes's father?
6520	Who is the spouse of the director of film Night Has A Thousand Eyes?
6521	When is Alfred V. Du Pont's father's birthday?
6522	Are Stelvio Cipriani and Giuliano Cenci both from the same country?
6523	Which film came out earlier, Hell And Mr. Fudge or Yes Or No??
6524	Which country the director of film Warsaw Bridge is from?
6525	Which film was released more recently, Bajo Otro Sol or Riding The California Trail?
6526	What is the date of death of Louis Ii, Count Palatine Of Zweibrücken's father?
6527	Which film has the director who was born later, Bloody Moon or Hot Tamale?
6528	Who is younger, Bekir Yılmaz or Miguel Hernández Agosto?
6529	When did Natalia Alexeievna (Wilhelmina Louisa Of Hesse-Darmstadt)'s mother die?
6530	Where did the director of film His Toughest Case die?
6531	Who is the paternal grandfather of Gruffudd Ab Owain Glyndŵr?
6532	Which film has the director died earlier, Woman In A Dressing Gown or Do Musafir?
6533	Do the movies The Godfather Part Iii and The Life And Hard Times Of Guy Terrifico, originate from the same country?
6534	Who is Adélaïde Of France (1732–1800)'s maternal grandfather?
6535	Who is Jack Schlossberg's father?
6536	Which film has the director who is older than the other, Life As It Comes or Dear Wendy? 
6537	Who is younger, Curuppumullage Jinarajadasa or W. K. Mcneil?
6538	Which film whose director was born first, He Is Charming or Men Without Wings?
6539	Which country Trịnh Thị Ngọc Trinh's husband is from?
6540	Which film came out earlier, A Wedding For Bella or Not For Publication?
6541	Which film has the director who is older, Overland Mail Robbery or Hearts Of The World?
6542	Who is older, Percy Rugg or Irwin Dambrot?
6543	What nationality is the performer of song Gone Fishin' (Song)?
6544	Are both directors of films Modern Mothers and The Slaughter Rule from the same country?
6545	Which film has the director died earlier, Say It With Sables or The Face At Your Window?
6546	Which film has the director who died later, Special Cop In Action or Tracked By The Police?
6547	Are Revolt In The Big House and The Fugitive (1914 Film) from the same country?
6548	What is the place of birth of the director of film God Of War (Film)?
6549	Which film has the director born first, Lawless Valley or L'Inhumaine?
6550	Where was the place of burial of Sonja Bernadotte's husband?
6551	What is the date of death of James Stewart-Murray, 9Th Duke Of Atholl's father?
6552	Are both Three Live Ghosts (1936 Film) and The Tailor From Ulm from the same country?
6553	Which film has the director died first, El Diablo Andaba En Los Choclos or Good Morning And... Goodbye!?
6554	What is the place of birth of the director of film Andriesh?
6555	Where did Amytis Of Media's husband die?
6556	Did the movies La Maternelle (Film) and La Provinciale (1981 Film), originate from the same country?
6557	Which film has the director who is older than the other, Shaft'S Big Score! or The Liberace Of Baghdad? 
6558	Which film was released more recently, Old Macdonald Had A Curve or Dear Mr. Prohack?
6559	When did John Stewart Of Bonkyll's father die?
6560	Which film was released more recently, The Unkissed Bride or Fiorile?
6561	Do director of film Taken 2 and director of film La Difficulté D'Être Infidèle have the same nationality?
6562	Which film has the director who was born earlier, Dhuen Ki Lakeer or Bomma Borusa?
6563	Are Gradur and Élie De Rothschild both from the same country?
6564	Does Barbara Rylko-Bauer have the same nationality as Samuel A. Peeples?
6565	Where was the director of film Kadathanaattu Maakkam born?
6566	Where did the director of film Blush (2015 Film) study?
6567	Who is Favila Of Asturias's mother?
6568	Do the movies Chocolate City (Film) and Dark Angel: The Ascent, originate from the same country?
6569	Which film has the director who was born earlier, The Forbidden Quest or In The Mood For Love?
6570	Where was the father of Benjamin Hardin Helm born?
6571	Which film has the director died first, Showdown At Boot Hill or The Walls Of Hell?
6572	Which film was released more recently, Fine Dead Girls or Venussian Tabutasco?
6573	Which film has the director died later, Fighting Through or In Folly'S Trail?
6574	Which film has the director who died first, Cotton Comes To Harlem or A Jester'S Tale?
6575	Which film has the director who was born earlier, The Night Of Nights or Carnival Night?
6576	Which country Marcus (Son Of Basiliscus)'s father is from?
6577	What is the place of birth of the director of film Clowning Around?
6578	Which film whose director is younger, Many Tanks Mr. Atkins or Do Musafir?
6579	Which film has the director who died earlier, The Student'S Romance or Kai Kodukkum Kai?
6580	Who is Charibert Ii's father?
6581	Where did the director of film Francis The Smuggler die?
6582	Which film has the director died first, Ask A Policeman or The Half-Naked Truth?
6583	Where did William Montagu, 2Nd Duke Of Manchester's father graduate from?
6584	Where was the director of film Paradesi (2007 Film) born?
6585	What is the place of birth of the performer of song That'S When Your Heartaches Begin?
6586	Which film has the director born earlier, Whoever Slew Auntie Roo? or Places In The Heart?
6587	Who died first, Louis-Paul-Armand Simonneaux or Josiah Boydell?
6588	Who is the father of the performer of song The Age Of Not Believing?
6589	What is the date of death of Sobhuza Ii's father?
6590	Are the directors of both films Lovers Lane (2005 Film) and Gross Misconduct: The Life Of Brian Spencer from the same country?
6591	Where did Hasan Ibn Hasan's father die?
6592	What is the date of death of the director of film Khanjar (1980 Film)?
6593	Who is younger, Achim Steiner or Norberto Bravo?
6594	Where was the father of Alexandre Grimaldi-Coste born?
6595	Which film was released more recently, Sex, Lies, And Videotape or The Last Seduction Ii?
6596	Who is the mother-in-law of Ramiro Sánchez?
6597	What is the place of birth of Peter Ii, Count Of Saint-Pol's mother?
6598	Which film was released first, Love, Sex And Eating The Bones or Le Rempart Des Béguines?
6599	Who is the paternal grandfather of Shahuji Ii?
6600	Who was born later, Bill Nye or Teo Tuvale?
6601	Did the movies Piccolo Grande Amore and One Day More (Film), originate from the same country?
6602	Which album was released earlier, This Thing Called Life or Pearls Iii (Close To The Edge)?
6603	Do director of film Slums Of Beverly Hills and director of film The Black Windmill share the same nationality?
6604	Are The Eyes, The Mouth and Sugar & Spice from the same country?
6605	Which film has the director who died later, Rani Mera Naam or Temptation In The Summer Wind?
6606	Which film has the director who died later, Strangers' Meeting or The Fortunate Fool?
6607	Which film was released more recently, The Magnificent Matador or Abcd: American-Born Confused Desi?
6608	Where did Emily Ruete's father die?
6609	Who is Rudolph De Trafford's paternal grandmother?
6610	Where was the place of death of the director of film Catherine & Co.?
6611	What is the place of birth of the director of film The Last Adventure (1967 Film)?
6612	Which country Bernard D'Armagnac, Count Of Pardiac's mother is from?
6613	Which film was released earlier, Drive Hard or Make-Out With Violence?
6614	Which film was released first, À L'Aventure or Dennis P.?
6615	Which film has the director who was born earlier, Una Storia D'Amore (1969 Film) or Ta Chvíle, Ten Okamžik?
6616	Where was the place of burial of Gülşah Hatun's husband?
6617	Which film has the director who died first, Harry And Tonto or Fortunat?
6618	Where was the mother of Marie Henriette Of Austria born?
6619	Was Domènec Sugrañes I Gras or David Koch (Television Presenter) born first?
6620	Which film has the director born earlier, Everyone Else or The Girl From The Chartreuse?
6621	Which film has the director who was born later, Achena Prem or The Death Kiss?
6622	Are both Coon Lake and Lake Verret located in the same country?
6623	Do David Elliot (Illustrator) and Eustace William Ferguson share the same nationality?
