3153	Which film has the director who was born later, Saturday Night Out or An Italian Romance?
3154	Who is Joanna, Duchess Of Durazzo's paternal grandmother?
3155	Are director of film 11:14 and director of film Born That Way (Film) both from the same country?
3156	Who is John Crichton-Stuart, 2Nd Marquess Of Bute's mother?
3157	Which film was released first, John Wick: Chapter 3 – Parabellum or How To Make Love To A Negro Without Getting Tired?
3158	Which film was released first, The Man In Grey or The Queen'S Traitor?
3159	Were Erich Kahn and Otto Kähler from the same country?
3160	Which film has the director who died later, The Obsessed Of Catule or Countess Ironing-Maid?
3161	Where did the composer of film Edavazhiyile Poocha Minda Poocha die?
3162	Which film came out earlier, Le Roi Des Champs-Élysées or Honoré De Marseille?
3163	What is the date of birth of Princess Marie Eleonore Of Albania's mother?
3164	Who is the paternal grandfather of Theobald Of Bar, Seigneur De Pierrepont?
3165	Are Sueko Matsueda Kimura and George Watterston both from the same country?
3166	Where did the director of film Night Journey (Film) die?
3167	Where did the director of film Camille (1915 Film) die?
3168	Where did the director of film Little Door Gods study?
3169	Which film came out earlier, Confusion Na Wa or Bloodfist Iii: Forced To Fight?
3170	Who is Elizabeth Of Pomerania's father-in-law?
3171	When was Albert, Duke Of Schleswig-Holstein's father born?
3172	What is the place of birth of Pompeia Plotina's husband?
3173	Where was the director of film Scarlet Seas born?
3174	What is the place of birth of Samuel Von Cocceji's father?
3175	Which country Aleksander Dominik Lubomirski's mother is from?
3176	Where was the director of film The Autumn Of Pride born?
3177	Who is Hugh Cholmondeley, 1St Earl Of Cholmondeley's paternal grandmother?
3178	Was Angel Koritarov or Jacek Kaspszyk born first?
3179	Are Schmale Gera and Lusatian Neisse located in the same country?
3180	Where was the performer of song Netflix (Song) born?
3181	Who is the father of the performer of song Instant Pleasure (Song)?
3182	What is the place of birth of the director of film Kailangan Ko'Y Ikaw?
3183	When did Otto Ii, Prince Of Anhalt-Aschersleben's father die?
3184	Which country the performer of song What You Need From Me is from?
3185	Are director of film Vapors (Film) and director of film Breach Of Promise (1932 Film) both from the same country?
3186	Who is John Philip Iii, Wild- And Rhinegrave Of Salm-Dhaun's paternal grandmother?
3187	Are both Achim Stoia and Elena Horvat from the same country?
3188	What is the place of birth of the director of film Small Town Boy?
3189	Which film came out earlier, A Wall Of Silence or Agent 3S3: Massacre In The Sun?
3190	Do both films It'S A Great Feeling and Oklahoma! (1999 Film) have the directors that share the same nationality?
3191	Which film was released more recently, 93 Days or Three Steps On Earth?
3192	When did the director of film Mistress Pamela die?
3193	Which film has the director died first, My First Two Hundred Years or Marshal Of Cedar Rock?
3194	Which film has the director died first, Tucson Raiders or Vai Que É Mole?
3195	Which film was released first, Sankaranum Mohananum or Cold Blade?
3196	Where did the creator of The Muppets On Puppets study?
3197	Which film has the director who is older than the other, Made In Ash or Every Saturday Night? 
3198	Which film has the director died later, Back To Nature or The Adventures Of Tartu?
3199	Which film has the director died first, Daughters Of Pleasure or Katha Sangama?
3200	Which film has the director who died earlier, Way Down East (1935 Film) or Dařbuján A Pandrhola?
3201	Which country the composer of film Diamond Head (Film) is from?
3202	What is the place of birth of the performer of song Imagine (John Lennon Song)?
3203	Which film has the director who died later, The House Of Tears or College Ranga?
3204	Which film has the director born earlier, A Sunday In September or The Hidden Way?
3205	Who is the paternal grandfather of St Andrew St John, 14Th Baron St John Of Bletso?
3206	Are The Barton Mystery (1920 Film) and Man On The Run from the same country?
3207	Who is the paternal grandfather of Nia Segamain?
3208	Which film was released first, Sound Of The Sea or The Road To Romance?
3209	Which film has the director born later, I Sette Dell'Orsa Maggiore or Length Of War?
3210	Who is younger, Bence Sipos or Jochen Eigenherr?
3211	When was Henry Cubitt, 2Nd Baron Ashcombe's mother born?
3212	Who was born first, Eli Corrêa Filho or Haby Niaré?
3213	Where was the husband of Monica (Singer) born?
3214	What is the place of birth of the composer of song La Poupée Qui Fait Non?
3215	Which film has the director born later, No Dough Boys or The Punch And Judy Man?
3216	Who is Sophia Charlotte Of Hanover's maternal grandfather?
3217	Who was born later, Cor Varkevisser or Alexander H. Mitchell?
3218	Which film has the director who is older, The Melon Route or Cilvēka Bērns?
3219	Who is Charles Of Provence's paternal grandfather?
3220	What is the date of birth of the director of film Then I Sentenced Them All To Death?
3221	What is the place of birth of the director of film True North Trilogy?
3222	Which film whose director was born first, Twilight Of Love or Song Of China?
3223	Which film was released more recently, Jalitgeola or 5 Against The House?
3224	Who is younger, Adam Morawski or Matt Kilcullen?
3225	Are Wizard Of The Saddle and Billy And Percy both from the same country?
3226	Who was born later, Andrzej Kryński or Keith Nichol?
3227	Which film has the director who died earlier, Song Of Dolores or El Coyote Emplumado?
3228	Which film has the director born first, A Strange Adventure or Don Quijote Cabalga De Nuevo?
3229	Which film has the director who died first, Pocket Money or Teenage Wolfpack?
3230	Who is Victoria Of France's maternal grandmother?
3231	Which film has the director born first, Demons Of War or Farce Of The Penguins?
3232	What is the place of birth of the director of film The One And Only Ivan (Film)?
3233	Are the movies The Brand New Testament and The Boss Of Rustler'S Roost, from the same country?
3234	Which album came out earlier, The Decline And Fall Of Heavenly or Alphagene?
3235	Which film has the director who was born later, Linden Lady On The Rhine or My General'S Women?
3236	Which film has the director died first, The Sin Of A Woman or Ten Modern Commandments?
3237	Who is Flavia Julia Constantia's maternal grandfather?
3238	Who is Prince Waldemar Of Schaumburg-Lippe's paternal grandmother?
3239	Who is Konrad Januszowic's maternal grandmother?
3240	Which film came out earlier, Le Voyage En Douce or Cobwebs In Concrete?
3241	What nationality is the director of film Tumi Jodi Kuwa?
3242	Where did Mirza Ulugh Tahir's father die?
3243	Which film has the director born later, The Wind'S Fierce or Special Delivery (1927 Film)?
3244	Who was born later, Martin Anthamatten or Jan-Lennard Struff?
3245	What is the place of birth of the composer of song Vem Vet?
3246	What nationality is the director of film Hello My Dear Wrong Number?
3247	What is the date of death of Thomas Henty's father?
3248	Which film came out first, Festival In Cannes or Petria'S Wreath?
3249	Where was the director of film The Blue Moth born?
3250	Where was the place of burial of Prince Vakhtang-Almaskhan Of Georgia's mother?
3251	Do the movies The Nut (1921 Film) and Emi (Film), originate from the same country?
3252	Who is the paternal grandfather of Tancred, King Of Sicily?
3253	Are both movies, A Sound Of Thunder (Film) and Sen Yan'S Devotion, from the same country?
3254	Which magazine came out first, Progetto Babele or Murray'S Magazine?
3255	Which film has the director who is older, Three Violent People or Girls In White?
3256	Who is Louis Vii, Duke Of Bavaria's father?
3257	Which film whose director is younger, Hell To Pay (2014 Film) or Darwin'S Nightmare?
3258	Where was the place of death of Flavia Domitilla (Saint)'s husband?
3259	Where was the place of death of Nina Caroline Studley-Herbert, 12Th Countess Of Seafield's father?
3260	Where was the mother of Francesco Iii Gonzaga, Duke Of Mantua born?
3261	Who is Theobald Ii, Count Of Champagne's paternal grandfather?
3262	Where was the place of death of the performer of song Solhverv?
3263	Which film has the director born later, South American George or Getting In?
3264	Where was the place of burial of the director of film The Public Defender?
3265	Were Tony Mendoza (Politician) and Ruthie Matthes from the same country?
3266	Which film has the director who died first, The Revenge Of Spartacus or Anubavam Pudhumai?
3267	Where was the place of burial of the director of film The Alamo (1960 Film)?
3268	When was the company that published The Miscellany News founded?
3269	Who was born later, Edward Alexander Newell Arber or Atieli Pakalani?
3270	Who is the uncle of Constantine Iii Of Scotland?
3271	Where did the performer of song The Radio Song (Joe Walsh Song) study?
3272	Which country the performer of song Reach Out For Me is from?
3273	Who is Charles Beauclerk, 1St Duke Of St Albans's stepmother?
3274	Which film whose director is younger, Forbidden Ground or Free Guy?
3275	Who is Princess Alexandra Of Sayn-Wittgenstein-Berleburg's father?
3276	Was Roger Hobbs or Bastiaan Geleijnse born first?
3277	Where did the performer of song Bags' Groove (Composition) study?
3278	Where was the place of death of Auguste-Louis-Albéric, Prince D'Arenberg's father?
3279	What nationality is the director of film Muvva Gopaludu?
3280	Where was the place of death of Christiane Eberhardine Of Brandenburg-Bayreuth's husband?
3281	Which film has the director born first, Sebastian And The Sparrow or Couldn'T Be Fairer?
3282	What nationality is the director of film 3Faltig?
3283	Which film has the director who died later, Jára Cimrman Lying, Sleeping or Mr. Ace?
3284	Which film was released earlier, Navavadhu or The January Man?
3285	Where was the director of film The Pittsburgh Kid born?
3286	Do both films Rain Man and Ping Pong Playa have the directors from the same country?
3287	Where did the director of film Don'T Knock The Ox graduate from?
3288	Who is the paternal grandfather of Charles Of Artois, Count Of Eu?
3289	Which film has the director who was born later, Toll Of The Desert or One Wild Ride?
3290	Who is younger, Thomas Praytor or Matthew Knox?
3291	Where was the composer of film Ride (2012 Film) born?
3292	Which film came out first, A Question Of The Heart or The Wannabes?
3293	What is the place of birth of the director of film Dracula: The Dark Prince?
3294	Was Kanwar Saheb or Dr. Alban born first?
3295	Are both bands, The Church (Band) and Kookies N Kream, from the same country?
3296	Who is the aunt of Elisabeth, Countess Of Vermandois?
3297	Who lived longer, Fred Keays or William H. Brand?
3298	Where was the place of death of Elisabeth Of Moravia's husband?
3299	Who is the father-in-law of Princess Amalia Of Nassau-Dietz?
3300	Which film has the director who is older than the other, Out Of The City or Floating Life? 
3301	Which film has the director who was born later, Jail Birds Of Paradise or Invisible Adversaries?
3302	What is the place of birth of the director of film Pontianak Harum Sundal Malam 2?
3303	Which film was released first, Bixler High Private Eye or Banna Bannada Loka?
3304	Which film was released more recently, A Devil Of A Woman or Love In The Big City 2?
3305	Who is the spouse of the performer of song Forever Everyday?
3306	Who is Shir Ali Oglan's paternal grandfather?
3307	Are Colin Bibby and Edwin J. Collins from the same country?
3308	Where was the place of death of William F. De Saussure's father?
3309	Where was the place of death of the director of film Circle Of The Sun?
3310	Where was the place of death of the composer of song (I'Ve Got) Beginner'S Luck?
3311	Who is Estrid Of The Obotrites's mother-in-law?
3312	What is the place of birth of the director of film Sweet Substitute (Film)?
3313	Who is George Ii, Landgrave Of Hesse-Darmstadt's father?
3314	Who died first, Frederick Cleveland Morgan or Nathaniel Mclenaghan?
3315	Where was the place of death of the director of film Dewan Bahadur (Film)?
3316	Which film was released earlier, Kalahasti Mahatyam or Killer Darts?
3317	What is the date of birth of Thoby Stephen's father?
3318	Who is the mother of the performer of song Passion (Utada Hikaru Song)?
3319	Who was born first out of Artur Mikvabia and Algernon Percy, 1St Earl Of Beverley?
3320	Do Jean-Martin De Prades and Marcel Henry have the same nationality?
3321	Who was born later, Robert De Vere, Duke Of Ireland or Son Seung-Joon?
3322	When did Joan Of Valois, Countess Of Hainaut's mother die?
3323	Where was the director of film The Phantom Foe born?
3324	Who is Agnes I, Countess Of Nevers's paternal grandfather?
3325	Which film was released more recently, I Once Had A Comrade or Happiness Is The Main Thing?
3326	Who is Humphrey, 2Nd Earl Of Buckingham's aunt?
3327	Who is the stepfather of Peter Phillips?
3328	Which film has the director died later, The White Truck or Mister Quilp?
3329	Where did the director of film Rozstanie die?
3330	Who was born first out of Gerardo Lugo Gómez and Tom Degnan?
3331	Which film has the director who died first, Wild Horse Rodeo or The Desert Island?
3332	Which film whose director is younger, Snack Bar Budapest or Pagalil Pournami?
3333	Which film has the director born later, A Prince For Christmas or The German Doctor?
3334	Which film was released earlier, Rocky'S Knife or Tu Mo Love Story?
3335	Which film was released more recently, Sikuru Hathe or Daughters, Daughters?
3336	When is Aaron Naparstek's mother's birthday?
3337	Did the movies Across The Sea Of Time and Monsignor (Film), originate from the same country?
3338	What is the award that the composer of song Dreaming From The Waist won?
3339	Which film has the director died later, Modern Husbands or The Fighting Vigilantes?
3340	Which film came out earlier, Return Of The Jedi or China Bound?
3341	Who is the mother-in-law of Blanche Of Navarre, Duchess Of Brittany?
3342	Which film was released more recently, Radio Tekee Murron or Bahala Chennagide?
3343	Where was the place of death of Charles I, Margrave Of Baden-Baden's father?
3344	Which country the director of film The Invisible Eye is from?
3345	Are P'Isaqa Kunka and Alcay (Huánuco) located in the same country?
3346	Who is Eudocia (Daughter Of Valentinian Iii)'s sibling-in-law?
3347	Which film was released earlier, His Brother'S Ghost or I Know What You Did Last Summer?
3348	Who is Konrad Iii The Old's paternal grandfather?
3349	Who is the paternal grandfather of Piers Butler Of Duiske?
3350	Which film was released more recently, Exit Smiling or Shapath?
3351	Was Olivier De Kersauson or Noel Forbes Humphreys born first?
3352	Who is the spouse of the director of film Emergency Wedding?
3353	Who is the maternal grandfather of Helvig Of Schauenburg?
3354	Who lived longer, Bronislav Gimpel or Lilavati Singh?
3355	Which country Nicole Briscoe's husband is from?
3356	Which film was released more recently, The Two Faces Of Dr. Jekyll or Hitler Meets Christ?
3357	Do both films, Adventure In Warsaw and Before The Lightning Strikes, have the directors who are from the same country?
3358	Where was the director of film Digna... Hasta El Último Aliento born?
3359	Where was the place of burial of the director of film The Roadhouse Murder?
3360	Who is Adolf Of Burgundy's paternal grandmother?
3361	Who is the maternal grandmother of André De Laval-Montmorency?
3362	When is the director of film Kalteva Torni 's birthday?
3363	Which film has the director who died first, Big Happiness or Border Romance?
3364	Which award the director of film Sazaa (1951 Film) got?
3365	Do both films The Majesty Of The Law and The Taint (Film) have the directors that share the same nationality?
3366	Who is younger, Denise Kandel or Bruce Robinson?
3367	Who was born first, Earl Alexander Olmsted or Pietro Ghislandi?
3368	What is the place of birth of Mary Sweeney's husband?
3369	Do the movies The Communist (Film) and Vella Kalpi, originate from the same country?
3370	Which film came out first, Blue Is The Warmest Colour or Danger Valley?
3371	What is the place of birth of Marisabel Rodríguez De Chávez's husband?
3372	Which film has the director who was born earlier, The Wedding Of Lilli Marlene or Professor Creeps?
3373	Where was the director of film Tremors 2: Aftershocks born?
3374	What is the place of birth of Archduchess Gregoria Maximiliana Of Austria's mother?
3375	Who lived longer, Chester Ray Benjamin or Ernest Duff?
3376	What is the place of birth of Albert, Margrave Of Baden-Hachberg's father?
3377	Are This'Ll Make You Whistle and The Christmas Candle both from the same country?
3378	Which film has the director who is older than the other, Taming Of The Fire or The Lady Takes A Flyer? 
3379	Which film has the director who died earlier, Il Gaucho or Bomgay?
3380	Where was the place of death of Hachiun's father?
3381	Which country the director of film Meri Shadi Karao is from?
3382	Which country the director of film The Lie (2018 Film) is from?
3383	Who is Godfrey Ii, Duke Of Lower Lorraine's paternal grandfather?
3384	Where did the director of film Cavalry (1936 American Film) die?
3385	Who is the paternal grandfather of Fakhr Al-Dawla?
3386	Where was the director of film Jan Dara (2001 Film) born?
3387	Which film has the director born later, Ask A Policeman or The Half-Naked Truth?
3388	Who is the paternal grandfather of King Kuang Of Zhou?
3389	What is the place of birth of the director of film The Sinner (1951 Film)?
3390	Where was the performer of song Hard Time Loving You born?
3391	What is the place of birth of the performer of song Forget About The World?
3392	Who is the father of the director of film At Five In The Afternoon?
3393	Who is the sibling-in-law of Budashiri?
3394	Who is younger, Robert Meiklejohn or Jennifer Padilla?
3395	Where was the place of death of Kim Utzon's father?
3396	What is the date of birth of George Frederick, Count Of Erbach-Breuberg's father?
3397	Which film was released earlier, The Goldcabbage Family Breaks The Bank or The King Of Marvin Gardens?
3398	Who lived longer, Xu Yulan or Miklós László?
3399	What is the place of birth of Adolphe De Leuven's father?
3400	Which film has the director who was born first, Dead Man'S Evidence or Creature Of The Walking Dead?
3401	Which film has the director who is older, The Last Airbender or Teyzem?
3402	Which country the director of film Citizen Mavzik is from?
3403	Where was the place of burial of Li Sujie's father?
3404	Where was the father of Chung Eui-Sun born?
3405	Which film came out earlier, The Complaint Of An Empress or Goldilocks And The Jivin' Bears?
3406	Where was the editor of magazine Argentus born?
3407	When did Richard De Clare, 6Th Earl Of Gloucester's father die?
3408	Which country Carol Victor, Hereditary Prince Of Albania's father is from?
3409	Who is Louisa Grace Beauclerk, Duchess Of St Albans's paternal grandfather?
3410	What is the place of birth of Sverre Krogh Sundbø's mother?
3411	What is the place of birth of Iva Mihanovic's husband?
3412	Are Dent Du Géant and Monte Matto both located in the same country?
3413	Who is Li Qi (Emperor)'s paternal grandfather?
3414	Which film was released earlier, Bullet For Hire or Strange People?
3415	Where did the composer of song Liza (All The Clouds'Ll Roll Away) die?
3416	Who is the spouse of the director of film There Was A Castle With Forty Dogs?
3417	Which film has the director who is older than the other, Confessionsofa Ex-Doofus-Itchyfooted Mutha or Four Dogs Playing Poker? 
3418	Who died first, Vincent Colyer or Carlo Borghesio?
3419	Where was the place of death of Francisca Pizarro Yupanqui's father?
3420	Where did the director of film Man Detained graduate from?
3421	Who is the father of the director of film The Seven Madmen?
3422	Which film has the director who was born earlier, Day Of The Cobra or Time Of Roses?
3423	Which film was released earlier, Dead Mine or Witch Story?
3424	Where does the director of film Scene Of The Crime (1986 Film) work at?
3425	Who is the husband of Princess Elene Of Georgia?
3426	Which film has the director who was born later, Kong: Skull Island or House Of Life?
3427	Who is younger, Stéphane Tissot or Jarmo Mäkinen?
3428	Why did the director of film Starsky And Hutch On Playboy Island die?
3429	Which film was released earlier, Into The Mirror or The Heart Of Casanova?
3430	Where did Thumelicus's father die?
3431	Who is the father-in-law of Princess Firyal?
3432	What is the date of death of the founder of Suez Canal Company?
3433	Do director of film Mustang (Film) and director of film Erotissimo share the same nationality?
3434	Are Abputi Gelal and Nagomari both located in the same country?
3435	Where did the director of film The Black Star (Film) die?
3436	Who is the father-in-law of Dimitra Liani?
3437	Who is the paternal grandfather of Louis Iv, Count Of Chiny?
3438	Where does the director of film The Brontë Sisters work at?
3439	What nationality is the performer of song When The Stars Go Blue?
3440	Are both villages, Gowy Daraq-E Olya and Kamalpuralam, located in the same country?
3441	Are the bands Attitude Adjustment and Blue (English Group), from the same country?
3442	Who is Ahmose-Henutemipet's paternal grandmother?
3443	Where was the director of film Death Of A Friend born?
3444	Who is the maternal grandmother of Mithridates Ii Of Commagene?
3445	Which film whose director is younger, Son Of God'S Country or The Court Concert?
3446	Which film has the director who died first, The Flyin' Cowboy or From Morn To Midnight?
3447	Where was the founder of university Vermont Studio Center born?
3448	What is the place of birth of the director of film Melati Van Agam (1931 Film)?
3449	Who is Asma Al-Assad's father-in-law?
3450	Which magazine came out first, Tit-Bits or Illustreret Nyhedsblad?
3451	When was Jarosław, Duke Of Opole's father born?
3452	Which country the director of film Paris: Xy is from?
3453	Are the directors of both films The Skyrocket and Double Take (2009 Film) from the same country?
3454	Where was the place of death of the director of film Tutyu And Totyo?
3455	Who is the paternal grandfather of Christopher Of Werle?
3456	Which film has the director born earlier, Farfallon or Man On The Tracks?
3457	Which film whose director is younger, Is The Man Who Is Tall Happy? or Heaven'S Rain?
3458	Who died later, Princess Anna Of Montenegro or Robert Plunket?
3459	Who is Lambert I, Count Of Louvain's father-in-law?
3460	What is the date of death of Duarte Of Portugal, 4Th Duke Of Guimarães's mother?
3461	Which film has the director who is older than the other, Agar Tum Na Hote or It'S Forever Springtime? 
3462	Where did Lady Byron's husband die?
3463	Which film has the director born earlier, To Dorothy A Son or Jurášek?
3464	Who is Agnes Of Austria (1281–1364)'s father-in-law?
3465	Which film was released more recently, 3 Nafas Likas or The Bravest Way?
3466	Who is the sibling-in-law of Bella Sidney Woolf?
3467	Which film came out first, A Gangstergirl or Duel In The Jungle?
3468	Do both films, Susanne In The Bath and The Lady From Argentina, have the directors who are from the same country?
3469	Who is the maternal grandmother of Maria Josepha Of Bavaria?
3470	Who died later, Pierre Lemonnier or Hasanaga Sadigov?
3471	Which country Clare Winnicott's husband is from?
3472	Where did the director of film The Phantom Carriage (1958 Film) die?
3473	What nationality is Humehume's father?
3474	Who is the stepfather of Peter I Of Aragon And Pamplona?
3475	Where was the place of death of Anna Of Pomerania's father?
3476	What is the date of death of Nishio Tadakata's father?
3477	Which film was released first, And Who Is Kissing Me? or Bush Christmas?
3478	Are both movies, National Lampoon'S Dorm Daze 2 and Gaby: A True Story, from the same country?
3479	What is the date of death of Richard Bootle-Wilbraham's father?
3480	Who died earlier, John Lysaght, 1St Baron Lisle or Arne Laurin?
3481	Where was the father of Tamás Esterházy (1570–1616) born?
3482	Where was the director of film Dogtown And Z-Boys born?
3483	Which film has the director who was born first, The Gigolos or More About The Children Of Noisy Village?
3484	Who is the paternal grandfather of Henrique Da Veiga De Nápoles?
3485	When did Frances Vane, Marchioness Of Londonderry's husband die?
3486	Which film has the director born later, Ringo The Lone Rider or The Woman The Germans Shot?
3487	Where was the wife of Vladimir Feldman born?
3488	Where was the director of film The Karate Kid (2010 Film) born?
3489	Which country Henry Cavendish, Earl Of Ogle's father is from?
3490	Are both movies, Inauguration Of The Pleasure Dome and Texans Never Cry, from the same country?
3491	Where does the founder of Interval Research Corporation work at?
3492	Which country Luís Of Portugal, Duke Of Beja's mother is from?
3493	Which film has the director who died first, Storm In A Water Glass or The Probation Wife?
3494	Who died later, Oliver A. Unger or Ross Story?
3495	Where was the father of Margaretha Von Waldeck born?
3496	Which film was released more recently, Return To Macon County or Nightmare Honeymoon?
3497	Which film has the director who died later, Lemon Grove Kids Meet The Monsters or I Learned It From Father?
3498	What is the award that the performer of song Somebody Already Broke My Heart won?
3499	Are director of film Private Worlds and director of film Ladies And Gentlemen, The Fabulous Stains from the same country?
3500	Which film has the director died earlier, Mrugaalaya or They Came To Blow Up America?
3501	Which country the composer of song Hey Gyp (Dig The Slowness) is from?
3502	What nationality is Dalfi D'Alvernha's father?
